number,found,source,doi,detail,raw,query
1,False,CR,,"CR: low confidence (23) — Newsletter 40, Aug, 1986","fake. fakefakefake. fakefake, 2(4):227–234, Aug. 1986. doi: 10.1007/ Bafe343fdfd346 4","fake. fakefakefake. fakefake, 2(4):227–234, Aug. 1986."
2,True,SS-DOI,10.1109/TVCG.2016.2615308,SS-DOI: Vispubdata.org: A Metadata Collection About IEEE Visualization (VIS) Publication (2017),"P. Isenberg, F. Heimerl, S. Koch, T. Isenberg, P. Xu, C. Stolper, M. Sedlmair, J. Chen, T. Möller, and J. Stasko. vispu","IEEE Transactions on Visualization and Computer Graphics, 23"
3,True,CR,,CR: Semi-automatic generation of transfer functions for direct volume rendering (1998),"G. Kindlmann. Semi-automatic generation of transfer functions for direct volume rendering. Master’s thesis, Cornell Univ",Semi-automatic generation of transfer functions for direct volume rendering
4,True,SS-title,,SS-title: The visualization toolkit user's guide : updated for version 4.0 (1998),"Kitware, Inc. The Visualization Toolkit User’s Guide, January 2003. 2",The Visualization Toolkit User’s Guide
5,True,CR,10.1145/37402.37422,CR: Marching cubes: A high resolution 3D surface construction algorithm (1987),W. E. Lorensen and H. E. Cline. Marching cubes: A high resolution 3D surface construction algorithm. SIGGRAPH Computer G,Marching cubes: A high resolution 3D surface construction algorithm
6,True,SS-DOI,10.1109/2945.468400,SS-DOI: Optical Models for Direct Volume Rendering (1995),"N. Max. Optical models for direct volume rendering. IEEE Transactions on Visualization and Computer Graphics, 1(2):99–10",Optical models for direct volume rendering
7,True,SS-DOI,10.1109/VISUAL.1991.175782,SS-DOI: The asymptotic decider: resolving the ambiguity in marching cubes (1991),"G. M. Nielson and B. Hamann. The asymptotic decider: Removing the ambiguity in marching cubes. In Proc. Visualization, p",The asymptotic decider: Removing the ambiguity in marching cubes
8,False,CR,,CR: low confidence (22) — Data structure forsoft objects,"G. Wyvill, C. McPheeters, and B. Wyvill. Data structure for soft objects. The Visual Computer, 2(4):227–234, Aug. 1986. ",Data structure for soft objects
